,company,datePublished,author,headline,description,articleBody,tags,url
15,PHH,2014-11-11T14:53:38+05:30,"{'@type': 'Person', 'name': 'webtech_news18'}",Viceroy Hotels consolidated Sep '14 sales at Rs 27.85 crore,Viceroy Hotels has reported a consolidated total income from operations of Rs 27.85 crore and a net loss of Rs 2.24 crore for the quarter ended Sep '14,"Viceroy Hotels has reported a consolidated total income from operations of Rs 27.85 crore and a net loss of Rs 2.24 crore for the quarter ended Sep '14.For the quarter ended Sep 2013 the consolidated total income from operations was Rs 27.28 crore and net loss was Rs 1.83 crore.Viceroy Hotels shares closed at 18.35 on November 10, 2014 (NSE) and has given 4.56% returns over the last 6 months and 10.88% over the last 12 months.Viceroy HotelsConsolidated Quarterly Results-------- in Rs. Cr. --------Sep '14Jun '14Sep '13Net Sales/Income from operations26.8623.8225.16Other Operating Income0.991.132.11Total Income From Operations27.8524.9527.28EXPENDITUREConsumption of Raw Materials5.305.105.50Purchase of Traded Goods------Increase/Decrease in Stocks------Power &amp;amp; Fuel3.222.962.98Employees Cost5.955.685.71Depreciation3.843.733.78Excise Duty------Admin. And Selling Expenses------R &amp;amp; D Expenses------Provisions And Contingencies------Exp. Capitalised------Other Expenses5.884.955.15P/L Before Other Inc., Int., Excpt. Items &amp;amp; Tax3.652.534.15Other Income------P/L Before Int., Excpt. Items &amp;amp; Tax3.652.534.15Interest6.155.945.98P/L Before Exceptional Items &amp;amp; Tax-2.50-3.42-1.83Exceptional Items------P/L Before Tax-2.50-3.42-1.83Tax-0.26-0.190.01P/L After Tax from Ordinary Activities-2.24-3.23-1.83Prior Year Adjustments------Extra Ordinary Items------Net Profit/(Loss) For the Period-2.24-3.23-1.83Minority Interest------Share Of P/L Of Associates------Net P/L After M.I &amp;amp; Associates-2.24-3.23-1.83Equity Share Capital42.4142.4142.41Reserves Excluding Revaluation Reserves------Equity Dividend Rate (%)------EPS Before Extra OrdinaryBasic EPS-0.53-0.76-0.41Diluted EPS-0.53-0.76-0.41EPS After Extra OrdinaryBasic EPS-0.53-0.76-0.41Diluted EPS-0.53-0.76-0.41Public Share HoldingNo Of Shares (Crores)3.133.123.12Share Holding (%)73.7073.6973.65Promoters and Promoter Group Shareholdinga) Pledged/Encumbered- Number of shares (Crores)0.700.780.77- Per. of shares (as a % of the total sh. of prom. and promoter group)62.5769.6268.49- Per. of shares (as a % of the total Share Cap. of the company)16.4518.3218.05b) Non-encumbered- Number of shares (Crores)0.420.340.35- Per. of shares (as a % of the total sh. of prom. and promoter group)37.4332.6231.51- Per. of shares (as a % of the total Share Cap. of the company)9.847.998.30Source :  Dion Global Solutions Limited","hotels, Results, Viceroy Hotels",https://www.moneycontrol.com//news/results/viceroy-hotels-consolidated-sep-14-sales-at-rs-2785-crore_1224877.html
16,PHH,2014-10-18T15:01:15+05:30,"{'@type': 'Person', 'name': 'webtech_news18'}",Viceroy Hotels: Updates on outcome of AGM,"Viceroy Hotels Ltd has submitted to BSE a copy of the minutes of the 49th Annual General Meeting (AGM) of the Company held on September 26, 2014.","Viceroy Hotels Ltd has submitted to BSE a copy of the minutes of the 49th Annual General Meeting (AGM) of the Company held on September 26, 2014.Source : BSE Read all announcements in Viceroy Hotels",Announcements,https://www.moneycontrol.com//news/announcements/viceroy-hotels-updatesoutcomeagm_1206900.html
17,PHH,2014-02-12T17:34:45+05:30,"{'@type': 'Person', 'name': 'webtech_news18'}",Viceroy Hotels consolidated Dec '13 sales at Rs 26.70 crore,Viceroy Hotels has reported a sales turnover of Rs 26.70 crore and a net loss of Rs 2.37 crore for the quarter ended Dec '13,"Viceroy Hotels has reported a consolidated sales turnover of Rs 26.70 crore and a net loss of Rs 2.37 crore for the quarter ended Dec '13.For the quarter ended Dec 2012 the consolidated sales turnover was Rs 29.38 crore and net loss was Rs 2.15 crore.Viceroy Hotels shares closed at 16.95 on February 11, 2014 (NSE) and has given 10.78% returns over the last 6 months and -26.30% over the last 12 months.Viceroy HotelsConsolidated Quarterly Results-------- in Rs. Cr. --------Dec '13Sep '13Jun '13Sales Turnover26.7027.2826.33Other Income------Total Income26.7027.2826.33Total Expenses19.6419.3420.04Operating Profit7.067.946.29Profit On Sale Of Assets------Profit On Sale Of Investments------Gain/Loss On Foreign Exchange------VRS Adjustment------Other Extraordinary Income/Expenses------Total Extraordinary Income/Expenses------Tax On Extraordinary Items------Net Extra Ordinary Income/Expenses------Gross Profit7.067.946.29Interest5.895.985.87PBDT1.171.960.42Depreciation3.753.783.73Depreciation On Revaluation Of Assets------PBT-2.58-1.82-3.31Tax-0.210.01-0.11Net Profit-2.37-1.83-3.20Minority Interest------Share Of P/L Of Associates------Net P/L After Minority Interest &amp;amp; Share Of Associates-2.37-1.83-3.20Prior Years Income/Expenses------Depreciation for Previous Years Written Back/ Provided------Dividend------Dividend Tax------Dividend (%)------Earnings Per Share------Book Value------Equity42.4142.4142.41Reserves------Face Value10.0010.0010.00Source :  Dion Global Solutions Limited","hotels, Results, Viceroy Hotels",https://www.moneycontrol.com//news/results/viceroy-hotels-consolidated-dec-13-sales-at-rs-2670-crore_1041614.html
18,PHH,2014-01-01T14:24:21+05:30,"{'@type': 'Person', 'name': 'webtech_news18'}",Viceroy Hotels concludes deal with JW Marriatt,"Viceroy Hotels Ltd has informed that the J.W. Marriatt deal had been concluded in favour of Ceebros Hotels Private Limited, Chennai as per the resolution passed by the shareholders and after reaching a settlement with the bankers of Chennai Project Division.","Viceroy Hotels Ltd has informed BSE that the J.W. Marriatt deal had been concluded in favour of 'Ceebros Hotels Private Limited', Chennai as per the resolution passed by the shareholders and after reaching a settlement with the bankers of 'Chennai Project Division'.Source : BSE Read all announcements in Viceroy Hotels",Announcements,https://www.moneycontrol.com//news/announcements/viceroy-hotels-concludes-dealjw-marriatt_1017176.html
19,PHH,2013-11-06T15:24:42+05:30,"{'@type': 'Person', 'name': 'webtech_news18'}",Viceroy Hotels consolidated Sep '13 sales at Rs 27.28 crore,Viceroy Hotels has reported a sales turnover of Rs 27.28 crore and a net loss of Rs 1.83 crore for the quarter ended Sep '13,"Viceroy Hotels has reported a consolidated sales turnover of Rs 27.28 crore and a net loss of Rs 1.83 crore for the quarter ended Sep '13.For the quarter ended Sep 2012 the consolidated sales turnover was Rs 27.55 crore and net loss was Rs 1.15 crore.Viceroy Hotels shares closed at 17.90 on November 05, 2013 (NSE) and has given -6.28% returns over the last 6 months and -27.24% over the last 12 months.Viceroy HotelsConsolidated Quarterly Results-------- in Rs. Cr. --------Sep '13Jun '13Mar '13Sales Turnover27.2826.3326.33Other Income------Total Income27.2826.3326.33Total Expenses19.3420.0418.01Operating Profit7.946.298.32Profit On Sale Of Assets------Profit On Sale Of Investments------Gain/Loss On Foreign Exchange------VRS Adjustment------Other Extraordinary Income/Expenses------Total Extraordinary Income/Expenses------Tax On Extraordinary Items------Net Extra Ordinary Income/Expenses------Gross Profit7.946.298.32Interest5.985.876.66PBDT1.960.421.66Depreciation3.783.733.65Depreciation On Revaluation Of Assets------PBT-1.82-3.31-1.99Tax0.01-0.11-0.44Net Profit-1.83-3.20-1.55Minority Interest------Share Of P/L Of Associates------Net P/L After Minority Interest &amp;amp; Share Of Associates-1.83-3.20-1.55Prior Years Income/Expenses------Depreciation for Previous Years Written Back/ Provided------Dividend------Dividend Tax------Dividend (%)------Earnings Per Share------Book Value------Equity42.4142.4142.41Reserves------Face Value10.0010.0010.00Source :  Dion Global Solutions Limited","hotels, Results, Viceroy Hotels",https://www.moneycontrol.com//news/results/viceroy-hotels-consolidated-sep-13-sales-at-rs-2728-crore_983929.html
