,company,datePublished,author,headline,description,articleBody,tags,url
15,SMC05,2014-10-16T21:59:58+05:30,"{'@type': 'Person', 'name': 'webtech_news18'}",SEL Manufacturing Company: Outcome of board meeting,"SEL Manufacturing Company has informed that the Paid up Share Capital of the Company has been increased from Rs. 331,34,70,000/- to Rs. 401,05,70,000/-, divided into 33,13,47,000 Equity Shares of Rs. 10/- each and 6,97,10,000, 1% Non-Cumulative.","SEL Manufacturing Company Ltd has informed BSE that the Paid up Share Capital of the Company has been increased from Rs. 331,34,70,000/- to Rs. 401,05,70,000/-, divided into 33,13,47,000 Equity Shares of Rs. 10/- each and 6,97,10,000, 1% Non-Cumulative, Non-Convertible Redeemable Preference Shares of Rs. 10/- each pursuant to allotment of 6,97,10,000, 1% Non-Cumulative, Non-Convertible, Redeemable Preference Shares of Rs. 10/- each by the Board of Directors of the Company at its meeting held on October 16, 2014 to the Promoters of the Company. The Company does not intend to list such Preference Shares on the Stock Exchange(s).Source : BSE Read all announcements in SEL Mgf Company",Announcements,https://www.moneycontrol.com//news/announcements/sel-manufacturing-company-outcomeboard-meeting_1205691.html
16,SMC05,2014-02-18T17:13:02+05:30,"{'@type': 'Person', 'name': 'webtech_news18'}",SEL Mgf Company consolidated Dec '13 sales at Rs 877.04 crore,SEL Manufacturing Company has reported a sales turnover of Rs 877.04 crore and a net loss of Rs 77.83 crore for the quarter ended Dec '13,"SEL Manufacturing Company has reported a consolidated sales turnover of Rs 877.04 crore and a net loss of Rs 77.83 crore for the quarter ended Dec '13. Other income for the quarter was Rs -29.49 crore.For the quarter ended Dec 2012 the consolidated sales turnover was Rs 940.51 crore and net profit was Rs 34.81 crore, and other income Rs 22.18 crore.SEL Mgf Company shares closed at 2.75 on February 17, 2014 (BSE) and has given -12.97% returns over the last 6 months and -24.45% over the last 12 months.SEL Manufacturing CompanyConsolidated Quarterly Results-------- in Rs. Cr. --------Dec '13Sep '13Jun '13Sales Turnover877.04787.831,306.00Other Income-29.4988.0775.58Total Income847.55875.901,381.58Total Expenses764.95690.851,140.31Operating Profit112.0996.98165.69Profit On Sale Of Assets------Profit On Sale Of Investments------Gain/Loss On Foreign Exchange------VRS Adjustment------Other Extraordinary Income/Expenses------Total Extraordinary Income/Expenses------Tax On Extraordinary Items------Net Extra Ordinary Income/Expenses------Gross Profit82.60185.05241.27Interest93.33136.1097.78PBDT-10.7348.96143.49Depreciation65.6461.4762.96Depreciation On Revaluation Of Assets------PBT-76.37-12.5180.53Tax1.58-14.2427.75Net Profit-77.951.7352.78Minority Interest0.120.200.23Share Of P/L Of Associates------Net P/L After Minority Interest &amp;amp; Share Of Associates-77.831.9353.00Prior Years Income/Expenses------Depreciation for Previous Years Written Back/ Provided------Dividend------Dividend Tax------Dividend (%)------Earnings Per Share--0.051.59Book Value------Equity331.35331.35331.35Reserves------Face Value10.0010.0010.00Source :  Dion Global Solutions Limited","Results, SEL Manufacturing Company, SEL Mgf Company, Textiles - General",https://www.moneycontrol.com//news/results/sel-mgf-company-consolidated-dec-13-sales-at-rs-87704-crore_1045179.html
17,SMC05,2013-09-24T21:46:21+05:30,"{'@type': 'Person', 'name': 'webtech_news18'}",SEL Manufacturing Company: Outcome of AGM,"SEL Manufacturing Company has informed about the outcome of 13th Annual General Meeting (AGM) of the Company was held on September 24, 2013.","SEL Manufacturing Company Ltd has informed BSE that the 13th Annual General Meeting (AGM) of the Company was held on September 24, 2013.Source : BSE Read all announcements in SEL Manufacturi",Announcements,https://www.moneycontrol.com//news/announcements/sel-manufacturing-company-outcomeagm_956108.html
18,SMC05,2013-09-03T17:32:15+05:30,"{'@type': 'Person', 'name': 'webtech_news18'}",SEL Manufacturing Company fixes book closure for AGM,"The Register of Members &amp;amp; Share Transfer Books of SEL Manufacturing Company will remain closed from September 16, 2013 to September 24, 2013 (both days inclusive) for the purpose of 13th Annual General Meeting (AGM) of the Company.","SEL Manufacturing Company Ltd has informed BSE that the Register of Members &amp;amp; Share Transfer Books of the Company will remain closed from September 16, 2013 to September 24, 2013 (both days inclusive) for the purpose of 13th Annual General Meeting (AGM) of the Company.Source : BSE Read all announcements in SEL Manufacturi",Announcements,https://www.moneycontrol.com//news/announcements/sel-manufacturing-company-fixes-book-closure-for-agm_944339.html
19,SMC05,2013-08-16T16:28:00+05:30,"{'@type': 'Person', 'name': 'webtech_news18'}","SEL Manufacturi consolidated Jun '13 sales at Rs 1,306.00 crore","SEL Manufacturing Company has reported a sales turnover of Rs 1,306.00 crore and a net profit of Rs 53.00 crore for the quarter ended Jun '13","SEL Manufacturing Company has reported a consolidated sales turnover of Rs 1,306.00 crore and a net profit of Rs 53.00 crore for the quarter ended Jun '13. Other income for the quarter was Rs 75.58 crore.For the quarter ended Jun 2012 the consolidated sales turnover was Rs 603.34 crore and net profit was Rs 17.00 crore, and other income Rs 31.42 crore.SEL Manufacturi shares closed at 3.35 on August 14, 2013 (NSE) and has given -9.46% returns over the last 6 months and -50.37% over the last 12 months.SEL Manufacturing CompanyConsolidated Quarterly Results-------- in Rs. Cr. --------Jun '13Mar '13Dec '12Sales Turnover1,306.001,506.39940.51Other Income75.5897.1822.18Total Income1,381.581,603.57962.69Total Expenses1,140.311,353.28772.66Operating Profit165.69153.11167.85Profit On Sale Of Assets------Profit On Sale Of Investments------Gain/Loss On Foreign Exchange------VRS Adjustment------Other Extraordinary Income/Expenses------Total Extraordinary Income/Expenses------Tax On Extraordinary Items------Net Extra Ordinary Income/Expenses------Gross Profit241.27250.29190.03Interest97.7895.89101.74PBDT143.49154.4088.30Depreciation62.9644.1647.06Depreciation On Revaluation Of Assets------PBT80.53110.2441.24Tax27.7539.256.51Net Profit52.7870.9934.73Minority Interest0.230.540.08Share Of P/L Of Associates------Net P/L After Minority Interest &amp;amp; Share Of Associates53.0071.5334.81Prior Years Income/Expenses------Depreciation for Previous Years Written Back/ Provided------Dividend------Dividend Tax------Dividend (%)------Earnings Per Share1.592.141.05Book Value------Equity331.35331.35331.35Reserves------Face Value10.0010.0010.00Source :  Dion Global Solutions Limited","Results, SEL Manufacturi, SEL Manufacturing Company, Textiles - General",https://www.moneycontrol.com//news/results/sel-manufacturi-consolidated-jun-13-sales-at-rs-130600-crore_936406.html
